[
  {
    "id": "recife-attraction-marco-zero",
    "city": "Recife",
    "title": "Marco Zero",
    "category": "attraction",
    "region": "Recife Antigo",
    "summary": "Praca historica e ponto de partida comum para visitar o centro antigo.",
    "content": "O Marco Zero fica na Praca Rio Branco, no bairro do Recife Antigo. O local concentra movimento de visitantes, feiras sazonais e acesso facil para caminhar pela area historica e pelos armazens culturais proximos.",
    "tags": [
      "centro historico",
      "recife antigo",
      "passeio a pe"
    ],
    "source": "manual:recife-v1",
    "updatedAt": "2026-03-20"
  },
  {
    "id": "recife-attraction-cais-do-sertao",
    "city": "Recife",
    "title": "Cais do Sertao",
    "category": "attraction",
    "region": "Recife Antigo",
    "summary": "Museu interativo focado na cultura nordestina e no universo de Luiz Gonzaga.",
    "content": "O Cais do Sertao oferece exposicoes interativas, recursos audiovisuais e experiencias sobre musica, territorio e cotidiano do sertao. Fica em area central do Recife Antigo e costuma ser combinado com outros pontos do bairro.",
    "tags": [
      "museu",
      "cultura",
      "interativo"
    ],
    "source": "manual:recife-v1",
    "updatedAt": "2026-03-20"
  },
  {
    "id": "recife-attraction-instituto-ricardo-brennand",
    "city": "Recife",
    "title": "Instituto Ricardo Brennand",
    "category": "attraction",
    "region": "Varzea",
    "summary": "Complexo cultural com museu, pinacoteca e area externa ampla.",
    "content": "O Instituto Ricardo Brennand reune colecoes de arte, biblioteca e um conjunto arquitetonico inspirado em castelo. O deslocamento ate a Varzea costuma demandar mais tempo em comparacao com atracoes centrais.",
    "tags": [
      "museu",
      "arte",
      "historia"
    ],
    "source": "manual:recife-v1",
    "updatedAt": "2026-03-20"
  },
  {
    "id": "recife-neighborhood-recife-antigo",
    "city": "Recife",
    "title": "Recife Antigo",
    "category": "neighborhood",
    "region": "Centro",
    "summary": "Area com concentracao de museus, praca historica e polos culturais.",
    "content": "Recife Antigo concentra pontos como Marco Zero, Paco do Frevo e Cais do Sertao. Para quem quer otimizar deslocamentos, vale reservar um periodo continuo para explorar o bairro a pe e reduzir trocas de transporte.",
    "tags": [
      "bairro",
      "centro",
      "museus"
    ],
    "source": "manual:recife-v1",
    "updatedAt": "2026-03-20"
  },
  {
    "id": "recife-neighborhood-boa-viagem",
    "city": "Recife",
    "title": "Boa Viagem",
    "category": "neighborhood",
    "region": "Zona Sul",
    "summary": "Area com praia urbana, calcadao e alta oferta de servicos.",
    "content": "Boa Viagem combina praia urbana com rede de restaurantes, hospedagem e comercio. E comum usar o bairro como base logistica por causa da oferta de transporte e da proximidade com o aeroporto.",
    "tags": [
      "praia",
      "zona sul",
      "hospedagem"
    ],
    "source": "manual:recife-v1",
    "updatedAt": "2026-03-20"
  },
  {
    "id": "recife-food-cafe-oficina-do-sabor",
    "city": "Recife",
    "title": "Oficina do Sabor",
    "category": "food_cafe",
    "region": "Alto da Se",
    "summary": "Restaurante conhecido em Olinda e frequentemente incluIdo em bate-volta saindo do Recife.",
    "content": "A Oficina do Sabor fica em Olinda, proximo ao Alto da Se, e aparece em roteiros gastronomicos combinados com passeio historico. Para quem esta hospedado no Recife, vale considerar tempo de deslocamento para ida e volta.",
    "tags": [
      "gastronomia",
      "olinda",
      "bate-volta"
    ],
    "source": "manual:recife-v1",
    "updatedAt": "2026-03-20"
  },
  {
    "id": "recife-food-cafe-cafe-jaqueira",
    "city": "Recife",
    "title": "Cafe na Jaqueira",
    "category": "food_cafe",
    "region": "Jaqueira",
    "summary": "Opcao de cafe e lanche em area residencial com movimento diurno.",
    "content": "A regiao da Jaqueira oferece cafes e padarias para pausas de meio de tarde. Pode ser uma boa alternativa para um ritmo mais tranquilo entre atividades mais longas do dia.",
    "tags": [
      "cafe",
      "lanche",
      "ritmo tranquilo"
    ],
    "source": "manual:recife-v1",
    "updatedAt": "2026-03-20"
  },
  {
    "id": "recife-logistics-airport-boa-viagem",
    "city": "Recife",
    "title": "Acesso aeroporto e Boa Viagem",
    "category": "logistics",
    "region": "Zona Sul",
    "summary": "Boa Viagem costuma reduzir tempo de deslocamento de chegada e saida.",
    "content": "Para chegadas e partidas com pouco intervalo, ficar em Boa Viagem tende a simplificar a logistica pelo acesso mais direto ao aeroporto. Em dias com agenda apertada, isso pode reduzir risco de atraso.",
    "tags": [
      "aeroporto",
      "deslocamento",
      "logistica"
    ],
    "source": "manual:recife-v1",
    "updatedAt": "2026-03-20"
  },
  {
    "id": "recife-logistics-praia-boa-viagem-cuidados",
    "city": "Recife",
    "title": "Cuidados na praia de Boa Viagem",
    "category": "logistics",
    "region": "Boa Viagem",
    "summary": "Orientacoes praticas para banho e uso da faixa de areia.",
    "content": "Ao planejar tempo de praia em Boa Viagem, consulte sinalizacao local e orientacoes publicas sobre trechos recomendados para banho. Em planejamento de roteiro, registre essa etapa como atividade com cuidado adicional.",
    "tags": [
      "praia",
      "seguranca",
      "cuidados"
    ],
    "source": "manual:recife-v1",
    "updatedAt": "2026-03-20"
  },
  {
    "id": "recife-attraction-paco-do-frevo",
    "city": "Recife",
    "title": "Paço do Frevo",
    "category": "attraction",
    "region": "Bairro do Recife Antigo",
    "summary": "O Paço do Frevo e um museu que preserva a cultura do frevo, um estilo de música e danca típico da região.",
    "content": "O Paço do Frevo fica localizado no Bairro do Recife Antigo, em Recife. O museu oferece exposicoes sobre a historia do frevo, bem como shows e eventos culturais ao longo do ano.",
    "tags": [
      "frevo",
      "museu",
      "recife antigo"
    ],
    "source": "llm-draft:recife-v1-expansion",
    "updatedAt": "2026-03-29"
  },
  {
    "id": "recife-food_cafe-mercado-de-sao-jose",
    "city": "Recife",
    "title": "Mercado de São José",
    "category": "food_cafe",
    "region": "Centro",
    "summary": "Mercado tradicional com variedade de produtos frescos e artesanais.",
    "content": "O Mercado de São José oferece uma experiencia gastronomica autentica com produtos frescos e artesanais. Visite e descubra as delicasidades locais, como frutas, legumes e produtos de panificacao.",
    "tags": [
      "mercado tradicional",
      "produtos frescos",
      "gastronomia local"
    ],
    "source": "llm-draft:recife-v1-expansion",
    "updatedAt": "2026-03-29"
  },
  {
    "id": "recife-attraction-torre-malakoff",
    "city": "Recife",
    "title": "Torre Malakoff",
    "category": "attraction",
    "region": "Recife Antigo",
    "summary": "Torre de ferro fundido construida em 1855, simbolizando a arquitetura militar do Imperio.",
    "content": "A Torre Malakoff foi construida em 1855 e e um dos principais pontos turisticos da cidade. Ela foi projetada para ser uma fortaleza, mas hoje e um simbolo da arquitetura militar do Imperio. O local oferece uma vista panoramica da cidade e e um local popular para fotos.",
    "tags": [
      "torre malakoff",
      "recife antigo",
      "arquitetura militar"
    ],
    "source": "llm-draft:recife-v1-expansion",
    "updatedAt": "2026-03-29"
  },
  {
    "id": "recife-attraction-patio-de-sao-pedro",
    "city": "Recife",
    "title": "Pátio de São Pedro",
    "category": "attraction",
    "region": "Recife Antigo",
    "summary": "Praça histórica e ponto de encontro no centro antigo de Recife.",
    "content": "O Pátio de São Pedro é um local emblemático da cidade, conhecido por suas ruas estreitas e arquitetura colonial. É um ótimo lugar para se perder e descobrir a história de Recife.",
    "tags": [
      "centro historico",
      "recife antigo",
      "patrimonio cultural"
    ],
    "source": "llm-draft:recife-v1-expansion",
    "updatedAt": "2026-03-29"
  },
  {
    "id": "recife-attraction-mamam",
    "city": "Recife",
    "title": "MAMAM - Museu de Arte Moderna Aloísio Magalhães",
    "category": "attraction",
    "region": "Boa Vista",
    "summary": "O MAMAM é um museu de arte moderna localizado no bairro de Boa Vista, em Recife.",
    "content": "O MAMAM é um dos principais museus de arte moderna da cidade de Recife. O museu conta com uma coleção de obras de artistas brasileiros e internacionais, além de exposições temporárias.",
    "tags": [
      "arte moderna",
      "museu",
      "recife"
    ],
    "source": "llm-draft:recife-v1-expansion",
    "updatedAt": "2026-03-29"
  },
  {
    "id": "recife-attraction-casa-da-cultura-de-pernambuco",
    "city": "Recife",
    "title": "Casa da Cultura de Pernambuco",
    "category": "attraction",
    "region": "Recife Antigo",
    "summary": "Instituicao cultural que promove eventos e exposicoes de arte e cultura.",
    "content": "A Casa da Cultura de Pernambuco fica no Recife Antigo, oferecendo exposicoes de arte, eventos culturais e atividades para visitantes. O local e um ponto de encontro para a comunidade cultural da cidade.",
    "tags": [
      "arte",
      "cultura",
      "recife antigo"
    ],
    "source": "llm-draft:recife-v1-expansion",
    "updatedAt": "2026-03-29"
  },
  {
    "id": "recife-attraction-teatro-santa-isabel",
    "city": "Recife",
    "title": "Teatro Santa Isabel",
    "category": "attraction",
    "region": "Recife Antigo",
    "summary": "Teatro historicamente importante, localizado no Recife Antigo.",
    "content": "O Teatro Santa Isabel foi fundado em 1850 e e um dos mais antigos teatros do Brasil. O local oferece apresentacoes culturais e eventos ao longo do ano.",
    "tags": [